{
  "schema_version": "3.0.0",
  "snapshot_id": "dps_3d552821e1c86c61303d",
  "domain_id": "business-tech",
  "domain_pack_version": "0.1.0",
  "profile_id": "dpf_business_default",
  "manifest_hash": "sha256:2e2278373e45a2843a5deb9bcd2ee3c2d01e65814a06890d18614b3273c96c08",
  "resolved_policy": {
    "policy_bundles": [
      {
        "ref": "policies/skeleton.json",
        "policy": {
          "policy_version": "0.1.0",
          "research": {
            "source_priority_policy": {
              "policy_version": "SOURCE-PRIORITY-POLICY-V1",
              "ranked_source_types": [
                "regulator_filing",
                "company_filing",
                "official_report",
                "official_press_release",
                "trusted_reporting",
                "feed"
              ],
              "mandatory_primary_source_types": [
                "regulator_filing"
              ]
            },
            "claim_research_policy": {
              "policy_version": "CLAIM-RESEARCH-POLICY-V1",
              "allowed_claim_types": ["company_statement", "reported_metric", "market_reaction"],
              "allowed_claim_statuses": ["reported", "attributed", "contested"],
              "allowed_authority_tokens": ["primary", "official", "reported"],
              "allowed_contradiction_kinds": ["value_conflict", "status_conflict"],
              "allowed_date_precisions": ["day", "month", "year"],
              "allowed_safe_wording_tokens": ["reported", "attributed", "according_to_source"],
              "allowed_visible_contradiction_wording_tokens": ["sources", "differ"]
            }
          },
          "planner": {"planner_policy":{"policy_version":"PLANNER-POLICY-V1","allowed_core_beat_kinds":["hook","context","promise","rise","reveal","contradiction","mechanism","example","consequence","counterargument","payoff","chapter_reset","final_question","reconstruct_timeline","compare_accounts","introduce_entity"],"allowed_domain_beat_subtypes":["earnings_reaction","operating_mechanism"],"allowed_editorial_roles":["mechanism","transition_support"],"allowed_visual_role_tokens":["show_evidence","show_mechanism","show_operational_consequence"],"allowed_safe_wording_tokens":["reported","attributed","according_to_source"],"min_sequence_duration_ms":30000,"max_sequence_duration_ms":90000,"max_claims_per_sequence":8,"max_asset_briefs_per_sequence":15,"min_edit_events_per_sequence":10,"max_edit_events_per_sequence":30}},
          "visual": {
            "generic_stock_role": "transition_support",
            "source_first": true,
            "asset_catalog_policy": {
              "policy_version": "ASSET-CATALOG-POLICY-V1",
              "allowed_asset_brief_roles": ["show_operational_consequence", "show_mechanism", "show_evidence"],
              "allowed_preferred_type_tokens": ["screen_recording", "real_broll", "official_visual", "document"],
              "allowed_avoid_context_tokens": ["generic_server_room", "abstract_binary", "typing_without_visible_code"],
              "allowed_domain_role_tokens": ["company", "product", "market_actor"],
              "allowed_domain_sensitivity_tokens": ["attribution_required", "financial_context"],
              "source_audio_reason_tokens": ["rights_confirmed", "rights_unknown", "no_source_audio"],
              "generic_stock_provider_tokens": ["pexels", "pixabay"],
              "reuse_cooldown_frames": 90,
              "chapter_family_budget": 2
            },
            "visualization_policy": {
              "policy_version": "VISUALIZATION-POLICY-V1",
              "allowed_kinds": ["chart", "metric", "timeline", "relationship_graph", "evidence_chain", "map"],
              "allowed_chart_kinds": ["line", "bar", "area", "stacked", "comparison", "waterfall", "timeline"],
              "banned_chart_kinds": [],
              "preferred_chart_kinds": ["line", "bar", "comparison"],
              "required_evidence_binding_kinds": ["source_capture_region"],
              "count_unit_labels": ["units"],
              "custom_unit_labels": ["index"],
              "allowed_relationship_edge_kinds": ["depends_on", "compares_with"],
              "theme_id": "business-tech-editorial-v1"
            }
          },
          "safety": {
            "require_attribution": true
          }
        }
      }
    ],
    "extensions": {
      "editorial_roles": [
        {
          "name": "mechanism",
          "version": "0.1.0",
          "description": "Explain the operating or economic mechanism behind a claim."
        }
      ],
      "claim_taxonomies": [
        {
          "name": "company_statement",
          "version": "0.1.0",
          "description": "A statement attributed to a company source."
        }
      ],
      "entity_roles": [
        {
          "name": "market_actor",
          "version": "0.1.0",
          "description": "An organization or person acting in a market."
        }
      ],
      "narrative_patterns": [
        {
          "name": "claim_mechanism_consequence",
          "version": "0.1.0",
          "description": "A minimal business-tech narrative pattern skeleton."
        }
      ],
      "visual_grammars": [
        {
          "name": "earnings_sting",
          "version": "0.1.0",
          "description": "A namespaced event example for financial evidence emphasis."
        }
      ],
      "event_types": [
        {
          "name": "earnings_sting",
          "version": "0.1.0",
          "description": "A declarative namespaced audio event example."
        }
      ],
      "safety_rules": [
        {
          "name": "attribution_required",
          "version": "0.1.0",
          "description": "Attributed business claims retain their source relationship."
        }
      ],
      "validation_rules": [
        {
          "name": "metric_source_required",
          "version": "0.1.0",
          "description": "Metrics require a source reference."
        }
      ]
    },
    "enabled_extensions": [],
    "overrides": {}
  },
  "canonical_hash": "sha256:3d552821e1c86c61303de6c1617d6fbcec8071e3f461c3f580a5eb49023aec1a",
  "immutable": true,
  "created_at": "2026-07-25T00:00:00Z",
  "version": 1
}
