{
  "schema_version": "3.0.0",
  "domain_id": "business-tech",
  "domain_pack_version": "0.1.0",
  "profile_id": "dpf_split_business",
  "manifest_hash": "sha256:4f5a291f1d992d5227410081b7a8b70f6f921d90ae17363372e1fce6140b618e",
  "resolved_policy": {
    "policy_bundles": [
      {
        "ref": "policies/skeleton.json",
        "policy": {
          "policy_version": "0.1.0",
          "research": {
            "source_priority_policy": {
              "policy_version": "SOURCE-PRIORITY-POLICY-V1",
              "ranked_source_types": [
                "regulator_filing",
                "company_filing",
                "official_report",
                "official_press_release",
                "trusted_reporting",
                "feed"
              ],
              "mandatory_primary_source_types": [
                "regulator_filing"
              ]
            },
            "claim_research_policy": {
              "policy_version": "CLAIM-RESEARCH-POLICY-V1",
              "allowed_claim_types": ["company_statement", "reported_metric", "market_reaction"],
              "allowed_claim_statuses": ["reported", "attributed", "contested"],
              "allowed_authority_tokens": ["primary", "official", "reported"],
              "allowed_contradiction_kinds": ["value_conflict", "status_conflict"],
              "allowed_date_precisions": ["day", "month", "year"],
              "allowed_safe_wording_tokens": ["reported", "attributed", "according_to_source"],
              "allowed_visible_contradiction_wording_tokens": ["sources", "differ"]
            }
          },
          "visual": {
            "generic_stock_role": "transition_support",
            "source_first": true,
            "asset_catalog_policy": {
              "policy_version": "ASSET-CATALOG-POLICY-V1",
              "allowed_asset_brief_roles": ["show_operational_consequence", "show_mechanism", "show_evidence"],
              "allowed_preferred_type_tokens": ["screen_recording", "real_broll", "official_visual", "document"],
              "allowed_avoid_context_tokens": ["generic_server_room", "abstract_binary", "typing_without_visible_code"],
              "allowed_domain_role_tokens": ["company", "product", "market_actor"],
              "allowed_domain_sensitivity_tokens": ["attribution_required", "financial_context"],
              "source_audio_reason_tokens": ["rights_confirmed", "rights_unknown", "no_source_audio"],
              "generic_stock_provider_tokens": ["pexels", "pixabay"],
              "reuse_cooldown_frames": 90,
              "chapter_family_budget": 2
            },
            "visualization_policy": {
              "policy_version": "VISUALIZATION-POLICY-V1",
              "allowed_kinds": ["chart", "metric", "timeline", "relationship_graph", "evidence_chain", "map"],
              "allowed_chart_kinds": ["line", "bar", "area", "stacked", "comparison", "waterfall", "timeline"],
              "banned_chart_kinds": [],
              "preferred_chart_kinds": ["line", "bar", "comparison"],
              "required_evidence_binding_kinds": ["source_capture_region"],
              "count_unit_labels": ["units"],
              "custom_unit_labels": ["index"],
              "allowed_relationship_edge_kinds": ["depends_on", "compares_with"],
              "theme_id": "business-tech-editorial-v1"
            },
            "template_policy": {
              "preferred_template_ids": [
                "article_focus_scan",
                "metric_reveal",
                "process_diagram",
                "kinetic_keyword"
              ],
              "banned_template_ids": [],
              "required_template_ids": [],
              "style_preset": {
                "preset_id": "business-tech-editorial-v1",
                "color_theme_id": "business-tech-slate-v1",
                "typography_id": "phase5-noto-sans-v1",
                "font_asset_hash": "sha256:bfb7bb691513f12e734dc346c03a03f784912432d7e3fa8e56efcf906fe86b3d",
                "tone_id": "business-tech-analytical-v1"
              }
            }
          },
          "safety": {
            "require_attribution": true
          }
        }
      }
    ],
    "extensions": {
      "editorial_roles": [
        {
          "name": "mechanism",
          "version": "0.1.0",
          "description": "Explain the operating or economic mechanism behind a claim."
        }
      ],
      "claim_taxonomies": [
        {
          "name": "company_statement",
          "version": "0.1.0",
          "description": "A statement attributed to a company source."
        }
      ],
      "entity_roles": [
        {
          "name": "market_actor",
          "version": "0.1.0",
          "description": "An organization or person acting in a market."
        }
      ],
      "narrative_patterns": [
        {
          "name": "claim_mechanism_consequence",
          "version": "0.1.0",
          "description": "A minimal business-tech narrative pattern skeleton."
        }
      ],
      "visual_grammars": [
        {
          "name": "earnings_sting",
          "version": "0.1.0",
          "description": "A namespaced event example for financial evidence emphasis."
        }
      ],
      "event_types": [
        {
          "name": "earnings_sting",
          "version": "0.1.0",
          "description": "A declarative namespaced audio event example."
        }
      ],
      "safety_rules": [
        {
          "name": "attribution_required",
          "version": "0.1.0",
          "description": "Attributed business claims retain their source relationship."
        }
      ],
      "validation_rules": [
        {
          "name": "metric_source_required",
          "version": "0.1.0",
          "description": "Metrics require a source reference."
        }
      ]
    },
    "enabled_extensions": [],
    "overrides": {}
  },
  "immutable": true,
  "created_at": "2026-07-25T00:00:00Z",
  "version": 1,
  "snapshot_id": "dps_aa54984607588b54d584",
  "canonical_hash": "sha256:aa54984607588b54d58498ec2037b8a967ecc2fddf01aaee3e6288a3a8e8a309"
}
